Yelp ID,Business name,Business address,Category,Average star rating,Review count,Price,review_text,vader_neg,vader_neu,vader_pos,vader_compound,vader_label
xYBWuHuof8vtUKACFKqhpg,Lagano,Dronningens Tværgade 22 1302 Copenhagen Denmark,"Italian, Food, Pizza",4.2,21,$,"Four star.

Actually, I have no idea where to get better pizza in Copenhagen.  I was recommended the place by an Italian Italian who speaks Italian and he...",0.069,0.784,0.147,0.3612,positive
2JF0D08KR9VQRtKY8EC2Lg,Halifax,Skolegade 9 2500 Valby Denmark,Burgers,3.8,17,$$,"Terrible service! 
I was charged 20kr for a glass of tap water (we ordered 400kr/$57US/€54  worth of food). I thought it was a mistake but told "" a refill...",0.171,0.784,0.045,-0.4574,negative
2JF0D08KR9VQRtKY8EC2Lg,Halifax,Skolegade 9 2500 Valby Denmark,Burgers,3.8,17,$$,"I cannot understand the buzz around Halifax. Reading the other reviews, I got high expectation. When I arrived at the restaurant, around 12 more people were...",0.0,1.0,0.0,0.0,neutral
2JF0D08KR9VQRtKY8EC2Lg,Halifax,Skolegade 9 2500 Valby Denmark,Burgers,3.8,17,$$,Really great place. The burger menu is great and you have the opportunity to make little changes to your burger (bun/chips/sauces) which really makes it...,0.0,0.661,0.339,0.9061,positive
2JF0D08KR9VQRtKY8EC2Lg,Halifax,Skolegade 9 2500 Valby Denmark,Burgers,3.8,17,$$,"I love burgers. And I've become a usual suspect at this joint, as I keep returning to the crime scene for more.
The build-your-own-burger concept is great...",0.154,0.622,0.224,0.5574,positive
2JF0D08KR9VQRtKY8EC2Lg,Halifax,Skolegade 9 2500 Valby Denmark,Burgers,3.8,17,$$,Great service. Good burgers and thick cut fries.  The BIZ (mushroom/goat cheese) was very tasty.  I found it strange that we were the only ones attempting...,0.119,0.669,0.213,0.6249,positive
C6YgtsXUiGgSgCwBowY5Dg,Bone's,Valby Tingsted 4 C 2500 Copenhagen Denmark,"American, Burgers, Barbeque",3.3,10,$$,"After a visit to Nordisk Film just up the street, this location is a welcoming sight for a hungry soul.
The service and smiley faces makes you feel right at...",0.0,0.833,0.167,0.6808,positive
C6YgtsXUiGgSgCwBowY5Dg,Bone's,Valby Tingsted 4 C 2500 Copenhagen Denmark,"American, Burgers, Barbeque",3.3,10,$$,"I really like this place. It has an real American menu with very good quality of material.
The spacious dinning room at two floors makes it good to take...",0.0,0.745,0.255,0.8354,positive
C6YgtsXUiGgSgCwBowY5Dg,Bone's,Valby Tingsted 4 C 2500 Copenhagen Denmark,"American, Burgers, Barbeque",3.3,10,$$,Now this is the place for good casual atmosphere where you can bring kids! I had to babysit one evening so I brought a 9 year old here and it was perfect....,0.0,0.769,0.231,0.8268,positive
Ec42Vd63k2gFO2Cvw8ngpA,Den Persiske Restaurant,Valby Langgade 10 2500 Valby Denmark,Restaurants,4.0,3,$,"Quite nice place with nice dishes, but nothing very special  (although I didn't order the day's special ).
A very safe option for an evening meal at the...",0.085,0.605,0.31,0.8212,positive
v07LzE6FG3gf8-HH2-SBGA,Royal Sandwich,Vigerslev Alle 34 2500 Copenhagen Denmark,Sandwiches,3.8,4,$,"It's a nice and clean space, with very friendly and happy staff.
They have a wide selection of buns, bread and bagels to make a sandwich. There are many...",0.0,0.659,0.341,0.9179,positive
811nkEKnltFSC-EPNqKLBw,Buffalo Pizza,Vigerslev Allé 34 2500 Copenhagen Denmark,"Pizza, Italian",3.8,13,$,"Perfect thickness of dough,  balanced topping...  exept from rocket (rucola), that they have in excess; and spot on time in the oven. 
I'm saving my fifth...",0.0,0.871,0.129,0.5719,positive
KksMwlaB8n920PKK0rct1g,La Stella,Toftegårds Plads 4 2500 Valby Denmark,"Fast Food, Pizza",4.5,2,$,"Very good neighbourhood option, probably worthy of walking few blocks further for their pita bread with ""bræsk bøf"". It is actually a well grilled patty.
My...",0.154,0.609,0.238,0.4391,positive
KksMwlaB8n920PKK0rct1g,La Stella,Toftegårds Plads 4 2500 Valby Denmark,"Fast Food, Pizza",4.5,2,$,"Fantastic pizza made in the traditional Italian style at a very reasonable price.

These people take pizza seriously.",0.08,0.751,0.169,0.4404,positive
jUlEOr4a3O9zx-9qzemx_A,Sticks 'n' Sushi,Valby Tingsted 4 A 2500 Valby Denmark,Sushi Bars,3.3,11,$$$,"Second best sushi I had so far in Copenhagen, best in a restaurant! Super service, smart set-up of the dining room and rather fast kitchen (considering how...",0.0,0.601,0.399,0.9459,positive
jUlEOr4a3O9zx-9qzemx_A,Sticks 'n' Sushi,Valby Tingsted 4 A 2500 Valby Denmark,Sushi Bars,3.3,11,$$$,"Best sushi I have ever eaten! Also the sticks! Very pleasant atmosphere, fantastic and super helpful service, a dream in one word!",0.0,0.43,0.57,0.9692,positive
YmsBxril_Hx1S0TAC8J3-w,Yousef's Spisested,Toftegårds Allé 28 2500 Valby Denmark,"Fast Food, Pizza, Kebab",3.1,7,$,"Options for grabbing a bite after midnight in Valby are limited, so I'm happy that this place exists!
What I've eaten was satisfying, but it took too long...",0.046,0.8,0.153,0.5157,positive
YmsBxril_Hx1S0TAC8J3-w,Yousef's Spisested,Toftegårds Allé 28 2500 Valby Denmark,"Fast Food, Pizza, Kebab",3.1,7,$,"Really shit service and the food tasted like dog. We waited 20 minutes in line (we stood in front of everybody), and then another 20-30 minutes for our...",0.12,0.803,0.077,-0.3384,negative
YmsBxril_Hx1S0TAC8J3-w,Yousef's Spisested,Toftegårds Allé 28 2500 Valby Denmark,"Fast Food, Pizza, Kebab",3.1,7,$,Upgraded to nice sitting place n nice service most importantly very tasty.,0.0,0.523,0.477,0.8016,positive
YmsBxril_Hx1S0TAC8J3-w,Yousef's Spisested,Toftegårds Allé 28 2500 Valby Denmark,"Fast Food, Pizza, Kebab",3.1,7,$,"Not especially interresting, and the service is not very good either. Prices a low, as the only udside. I'm a local, and take it from me, there is...",0.154,0.846,0.0,-0.5751,negative
5ufqF3aQzOwRXnjF7NMFlA,Rumbles,Gammel Køge Landevej 22 2500 Valby Denmark,Burgers,2.7,3,,"Amazing burger! I tried the gorilla burger and it was massive! The meat was huge (at least compared to other burgers in cph) and it was delicious.

They...",0.0,0.707,0.293,0.8856,positive
60blYrVWTsx3PW5QCXUzJg,Dilans Pizzaria og Burgerhouse,Sjælør Boulevard 42 2450 Copenhagen Denmark,Pizza,3.8,6,$$,"Shared a ""Mexicana"" pizza with the husband, and it was amazing! The flavor was perfect, and the serving size was huge! We just ordered one regular pizza ""as...",0.0,0.652,0.348,0.915,positive
60blYrVWTsx3PW5QCXUzJg,Dilans Pizzaria og Burgerhouse,Sjælør Boulevard 42 2450 Copenhagen Denmark,Pizza,3.8,6,$$,"We bought two pizzas - Vegetarina (#3) and Vegetar (#111). Later, we added separately bought ""parmaskinke"" meat, ~35g on each pizza. I recommend trying this...",0.0,0.906,0.094,0.3612,positive
xHThmi4POD0zTB-ik8N4og,Que Pasa,Bogholder Allé 65 2720 Vanløse Denmark,Mexican,4.4,14,$$,"This place is owned and run by an American and his lovely Danish wife. It's very credible Mexican, and should be, because Jon the charismatic owner grew up...",0.0,0.877,0.123,0.5859,positive
xHThmi4POD0zTB-ik8N4og,Que Pasa,Bogholder Allé 65 2720 Vanløse Denmark,Mexican,4.4,14,$$,"It's hard finding a decent Mexican food place in Denmark. 
Low and behold, I got lucky. 
Having been referred here by a friend, I have to say, I had high...",0.099,0.732,0.169,0.5423,positive
xHThmi4POD0zTB-ik8N4og,Que Pasa,Bogholder Allé 65 2720 Vanløse Denmark,Mexican,4.4,14,$$,"This place is a diamond in the rough! Agreed with the commenter that it is the most authentic Tex-mex I have had in CPH so far, and I will definitely be...",0.0,0.789,0.211,0.7574,positive
xHThmi4POD0zTB-ik8N4og,Que Pasa,Bogholder Allé 65 2720 Vanløse Denmark,Mexican,4.4,14,$$,"i haven't found real mexican food here yet and i've pretty much given up searching. but little by little, i'm overcoming my fear of trying tex mex in...",0.133,0.802,0.065,-0.4939,negative
xHThmi4POD0zTB-ik8N4og,Que Pasa,Bogholder Allé 65 2720 Vanløse Denmark,Mexican,4.4,14,$$,"This is the place if you wanna get Mexican food in Copenhagen! The owner was very friendly, originally from Southern California, and knew how make good...",0.0,0.782,0.218,0.7707,positive
xHThmi4POD0zTB-ik8N4og,Que Pasa,Bogholder Allé 65 2720 Vanløse Denmark,Mexican,4.4,14,$$,"Good Mexican restaurant. It's not very cheap, but the dishes are big and the quality is high. The owner is a very nice person",0.0,0.783,0.217,0.7261,positive
xHThmi4POD0zTB-ik8N4og,Que Pasa,Bogholder Allé 65 2720 Vanløse Denmark,Mexican,4.4,14,$$,"It's fantastic -- the best Mexican food in Denmark. The service is good and the meals are top quality - so it's great value for money. The proprietor, Jon,...",0.0,0.541,0.459,0.9615,positive
UIrMj583BAQDR6DxOIIVdA,Sushi Stop,Vesterbrogade 187 1800 Frederiksberg Denmark,"Sushi Bars, Japanese, Chinese",4.0,4,,"There are very few restaurants in Copenhagen, let alone Denmark that I can get something spicy to eat. The owner here seems to like to go out if his way to...",0.06,0.866,0.075,0.128,positive
uEUP01LstVgUPBJ569gKow,VACA Mexican Finger Food,Valby Langgade 47 2500 Valby Denmark,Mexican,2.0,7,$,"They were nice and the place is sort of clean.  However, waited  well over an hour before they finally started my order and of course they screwed it up....",0.09,0.704,0.206,0.4779,positive
uEUP01LstVgUPBJ569gKow,VACA Mexican Finger Food,Valby Langgade 47 2500 Valby Denmark,Mexican,2.0,7,$,It was the worst Mexican food I've ever tasted. Col crap and nothing Mexican about it accept the coriander I had to pay 10 kronors to get,0.24,0.682,0.077,-0.6705,negative
uEUP01LstVgUPBJ569gKow,VACA Mexican Finger Food,Valby Langgade 47 2500 Valby Denmark,Mexican,2.0,7,$,"This sucked! Like eating from a bad canteen, the whole staff was wasted, its so obvious that it was way too expensive and if you are thinking about what's...",0.267,0.667,0.067,-0.8172,negative
uEUP01LstVgUPBJ569gKow,VACA Mexican Finger Food,Valby Langgade 47 2500 Valby Denmark,Mexican,2.0,7,$,"Finally a very good Mexican place in Copenhagen!  The atmosphere is casual and cozy, you order at the counter.  The food is fresh and tasty and not overly...",0.0,0.767,0.233,0.7639,positive
uEUP01LstVgUPBJ569gKow,VACA Mexican Finger Food,Valby Langgade 47 2500 Valby Denmark,Mexican,2.0,7,$,"The worst taco I ever had. Cold, no flavors just heat for no reason. And a weird meatball",0.421,0.579,0.0,-0.8481,negative
KSoUxoRYRQl3g2ui2JKoBA,Antico Forno A Legna,Jydeholmen 49 2720 Vanløse Denmark,Restaurants,4.5,2,$,"Very good Pizza, although i only take Margarita but due to the wooden owen it just makes the taste of pizza really nice. I also believe all ingredients are...",0.0,0.812,0.188,0.738,positive
KSoUxoRYRQl3g2ui2JKoBA,Antico Forno A Legna,Jydeholmen 49 2720 Vanløse Denmark,Restaurants,4.5,2,$,"We walked over and ordered two pizzas.  Very tasty!  They were quite helpful and friendly.  Translated a few items to English, and even spoke Spanish to us...",0.0,0.785,0.215,0.7813,positive
_olXSDLDbjrmoh8oQfWd0A,UMI,Jernbane Alle 48 2720 Copenhagen Denmark,Sushi Bars,4.0,3,,"This new sushi place is really, really good.

Everything from the modern decor (love the lamps) and the cool ceramic plates to the fresh delectable sushi...",0.0,0.565,0.435,0.9448,positive
KoFPc_gf2AUaqx5PnJyN3w,Burger Garage,Vanløse Torv 1 2720 Copenhagen Denmark,Burgers,4.2,5,$,"Very good burgers and fries!  We enjoyed eating here and had a nice experience sitting outside as always when in Europe. Our server was fantasize, friendly...",0.0,0.632,0.368,0.915,positive
KoFPc_gf2AUaqx5PnJyN3w,Burger Garage,Vanløse Torv 1 2720 Copenhagen Denmark,Burgers,4.2,5,$,"Myself and my husband are both vegetarian and when we crave a burger we always go here. We always order ""The Happy Veggie"" burger, sweet potato fries and...",0.0,0.795,0.205,0.7717,positive
ng7TPmNouBWvDyMlFclOVw,Teppan House,Dirch Passers Allé 25 2000 Copenhagen Denmark,"Japanese, Asian Fusion",3.3,8,$$,"The reason I choose this restaurant is because 1) it's very close to my place, and 2) the 4 star TripAdvisor review. I booked a table here for a birthday...",0.0,1.0,0.0,0.0,neutral
Tqxn3G4BjjWW8KkjznZt3w,Mae Pen,Dirch Passers Allé 84 2000 Frederiksberg Denmark,Thai,4.0,3,$,"Great food, great staff 

Pad Thai is phenomenal and authentic. Super kid friendly and not dingy like many takeout places can be.",0.061,0.494,0.445,0.9348,positive
QJi8VGsEI7NR-KiwVJxIcA,Pomodoro & Mozzarella,Godthåbsvej 140 2000 Frederiksberg Denmark,"Food, Italian, Pizza",4.1,8,$,"OK pizza I guess. Not my style though. The menu seems to be one of those generic ""let's see how many random combinations we can create from this number of...",0.0,0.81,0.19,0.6523,positive
qfDZRrLdRwR_dKETRntHew,Hos Trine og Christian,Peter Bangs Vej 46 2000 Frederiksberg Denmark,Restaurants,4.7,3,$$,Went back with my colleagues for the annual Christmas dinner - it was as good as always.,0.0,0.847,0.153,0.4404,positive
h735_Vv2QVwMEmnml0L1pg,Zeybek Pizza,Grøndals Parkvej 81 2720 Vanløse Denmark,Pizza,1.8,5,$$,"I have ordered delivery from Zeybek on several occasions, mainly because it is convenient and is the only place that makes a burrito that will deliver to...",0.0,1.0,0.0,0.0,neutral
83bPuhfqCUrHlsJCeKsJNA,Café A,Dirch Passers Alle 17 2000 Copenhagen Denmark,"American, Breakfast & Brunch",3.0,8,$,"Service was very mediocre. The staff was unprofessional to each other and also to us. I got the Cafe A burger which was tasty and a large portion, came with...",0.102,0.898,0.0,-0.5106,negative
83bPuhfqCUrHlsJCeKsJNA,Café A,Dirch Passers Alle 17 2000 Copenhagen Denmark,"American, Breakfast & Brunch",3.0,8,$,"Opened approx 1 year, casual cafe bistro with any kind of food. Not trendy but you get exactly what you want. Good service , easy food with a nice...",0.0,0.627,0.373,0.9224,positive
83bPuhfqCUrHlsJCeKsJNA,Café A,Dirch Passers Alle 17 2000 Copenhagen Denmark,"American, Breakfast & Brunch",3.0,8,$,"This review is over two times since my second time is the last time ever! First time I was there with a friend, we sat outside, in the sun since there...",0.0,0.896,0.104,0.5411,positive
B1lJM9ZvxbMrA1MuiQa6PQ,La Buca,Godthåbsvej 209 2720 Vanløse Denmark,Italian,3.9,8,$$,A little out of the way but I now know why people make the effort. First of all the the staff are friendly and helpful and even though the place was packed...,0.0,0.789,0.211,0.8402,positive
B1lJM9ZvxbMrA1MuiQa6PQ,La Buca,Godthåbsvej 209 2720 Vanløse Denmark,Italian,3.9,8,$$,"Super dejlig sted, med god betjening.. Ligger dog i den dyre ende. Men værd et besøg..",0.0,0.7,0.3,0.7184,positive
JoBZBvqEpO9YgiZoT3eLwQ,Oki Sushi,Frederikssundsvej 74 2400 København NV Denmark,"Sushi Bars, Japanese",3.9,29,$$,"After visiting Oki sushi I can easily say that was the best sushi experience I have had in Copenhagen so far. 

Me and my girlfriend went the for the ""All...",0.0,0.809,0.191,0.765,positive
JoBZBvqEpO9YgiZoT3eLwQ,Oki Sushi,Frederikssundsvej 74 2400 København NV Denmark,"Sushi Bars, Japanese",3.9,29,$$,"Probably not the best sushi in the world but if you feel like eating a lot and u wanna eat sushi, that's the place. With a fair price, you get all you can...",0.057,0.782,0.162,0.6144,positive
JoBZBvqEpO9YgiZoT3eLwQ,Oki Sushi,Frederikssundsvej 74 2400 København NV Denmark,"Sushi Bars, Japanese",3.9,29,$$,"I would call it "" fast and furious"" 
The sushi are far from the quality of stick and sushi, we came for testing the place, I'm afraid we will not come back",0.107,0.893,0.0,-0.5719,negative
JoBZBvqEpO9YgiZoT3eLwQ,Oki Sushi,Frederikssundsvej 74 2400 København NV Denmark,"Sushi Bars, Japanese",3.9,29,$$,"I thought I was ordering all you can eat but...
When I went to pay the bill it was three times what it should have been!  The sushi was quite good (not the...",0.043,0.834,0.123,0.61,positive
JoBZBvqEpO9YgiZoT3eLwQ,Oki Sushi,Frederikssundsvej 74 2400 København NV Denmark,"Sushi Bars, Japanese",3.9,29,$$,Came for an all you can eat on a late Thursday afternoon. They easily accommodated my no cucumber request. The service was very quick and the sushi tasty.,0.072,0.85,0.078,0.0516,positive
DO5P6-MvLb0pRNX4D4zw3A,Famosi E Golosi,Rolighedsvej 10 1958 Frederiksberg Denmark,Italian,4.1,9,$$,"Went to this little restaurant during dining week. We arrived early but our table was ready and we got bread and wine really fast.

The menu was fixed...",0.0,0.893,0.107,0.5023,positive
DO5P6-MvLb0pRNX4D4zw3A,Famosi E Golosi,Rolighedsvej 10 1958 Frederiksberg Denmark,Italian,4.1,9,$$,"This restaurant is simply fantastic. Both the food, the ambiance and the service is outstanding. It's a little piece of Italy in Copenhagen. I'll definitely...",0.0,0.681,0.319,0.8834,positive
jFCUweRGD52NxgCT4rKPXw,Chai Wong,Thorvaldsensvej 2 1871 Frederiksberg Denmark,Thai,3.1,18,$$$,"Very Nice food. They were busy tonight and the food and drinks took too long to get there but in 1,5 hours we had eaten starters and mains so no worry. 
The...",0.0,0.803,0.197,0.7288,positive
jFCUweRGD52NxgCT4rKPXw,Chai Wong,Thorvaldsensvej 2 1871 Frederiksberg Denmark,Thai,3.1,18,$$$,"Friday was date night and my husband had gone out of his way to treat me to a romantic night out.

So we headed for this small Thai restaurant famed for...",0.0,0.843,0.157,0.6597,positive
jFCUweRGD52NxgCT4rKPXw,Chai Wong,Thorvaldsensvej 2 1871 Frederiksberg Denmark,Thai,3.1,18,$$$,Delicius food - friendly but  inattentive service,0.0,0.741,0.259,0.2732,positive
L0QhVI-Z6vpC1bc7ZC5buw,Madhus 24,Søborg Hovedgade 24 2870 Dyssegård Denmark,Danish,4.4,9,$,We were just driving through the area looking for lunch.  We spotted the outside tables and stopped.  The waitress spoke some English and gave us a menu...,0.068,0.932,0.0,-0.2263,negative
L0QhVI-Z6vpC1bc7ZC5buw,Madhus 24,Søborg Hovedgade 24 2870 Dyssegård Denmark,Danish,4.4,9,$,"Heard a lot about this place and finally visited. I got ""den sunde"" which was really good and you got full but without being too much. You can even...",0.0,0.93,0.07,0.2724,positive
-8UF14UutougxfZ5LP65qA,Mit Lille Køkken,Peter Bangsvej 60 2000 Frederiksberg Denmark,"Open Sandwiches, Danish",5.0,1,,Best value for money open face sandwiches in Copenhagen. Don't miss it!,0.0,0.519,0.481,0.8093,positive
MA42QTrccHqpeVBFb3Kc3A,Safir Kebab,Jagtvej 23 2200 København N Denmark,"Barbeque, Middle Eastern, Turkish",3.7,25,$,"Really great restaurant, great service and great food. Also low prices and a very good selection of non-alcohol drink. 
The place is nice and cozy and you...",0.05,0.501,0.449,0.9568,positive
MA42QTrccHqpeVBFb3Kc3A,Safir Kebab,Jagtvej 23 2200 København N Denmark,"Barbeque, Middle Eastern, Turkish",3.7,25,$,"I was really excited to finally have kebabs and I wanted something good, not just some random shop with meat that has been sitting in the fridge for a...",0.0,0.828,0.172,0.6801,positive
MA42QTrccHqpeVBFb3Kc3A,Safir Kebab,Jagtvej 23 2200 København N Denmark,"Barbeque, Middle Eastern, Turkish",3.7,25,$,I really feel like one of the more important things to do in life when you first move to a city is to take note of where the cheap and easy (and arguably...,0.052,0.748,0.2,0.6976,positive
MA42QTrccHqpeVBFb3Kc3A,Safir Kebab,Jagtvej 23 2200 København N Denmark,"Barbeque, Middle Eastern, Turkish",3.7,25,$,I am always on the hunt for a good Kebab and I can not even remember the last time I sat down and actually had a plate in front of me. I always order a pita...,0.084,0.844,0.072,-0.128,negative
MA42QTrccHqpeVBFb3Kc3A,Safir Kebab,Jagtvej 23 2200 København N Denmark,"Barbeque, Middle Eastern, Turkish",3.7,25,$,"i might not be able to come here to get my 2am falafel, but i will definitely be back for more lunches and dinners. the shawarma and chicken dish at 59kr...",0.0,0.894,0.106,0.5499,positive
MA42QTrccHqpeVBFb3Kc3A,Safir Kebab,Jagtvej 23 2200 København N Denmark,"Barbeque, Middle Eastern, Turkish",3.7,25,$,I live right next by so I eat here frequently. The food is always great and so is all the lovely staff who welcome me with a big smile every time I go there.,0.0,0.691,0.309,0.9246,positive
MA42QTrccHqpeVBFb3Kc3A,Safir Kebab,Jagtvej 23 2200 København N Denmark,"Barbeque, Middle Eastern, Turkish",3.7,25,$,Second meal here in the last month and again excellent.  The bread is amazing - baked in a stone oven on site and provided to you with hummus while you wait...,0.0,0.795,0.205,0.8176,positive
Cv3eiXerzysKQ69IdBj5Tw,Grillen Nørrebro,Nørrebrogade 13 2200 Copenhagen Denmark,"Burgers, Fast Food",3.7,94,$,I love getting a bacon cheeseburger and curly fries every time I come to Denmark! Burger is massive! Be wary the pickles are sweet - not dill. Drinks do not...,0.0,0.782,0.218,0.8309,positive
Cv3eiXerzysKQ69IdBj5Tw,Grillen Nørrebro,Nørrebrogade 13 2200 Copenhagen Denmark,"Burgers, Fast Food",3.7,94,$,"After visiting Grillen a handful of times it is my number one choice when I crave a burger. 

They have around 8 options of burgers, 3 options of fries...",0.0,0.956,0.044,0.0772,positive
Cv3eiXerzysKQ69IdBj5Tw,Grillen Nørrebro,Nørrebrogade 13 2200 Copenhagen Denmark,"Burgers, Fast Food",3.7,94,$,"I liked the cozy atmosphere with the rustic theme.
The menu could use a little more options for fish lovers and vegetarians. There is literally only one...",0.0,0.801,0.199,0.7351,positive
Cv3eiXerzysKQ69IdBj5Tw,Grillen Nørrebro,Nørrebrogade 13 2200 Copenhagen Denmark,"Burgers, Fast Food",3.7,94,$,"Delicious burger and fries!! A must have eaten for Copenhagen, for real!! Was really good and we couldn't even eat the whole burger bcs it was soooooo big!!",0.0,0.763,0.237,0.8427,positive
Cv3eiXerzysKQ69IdBj5Tw,Grillen Nørrebro,Nørrebrogade 13 2200 Copenhagen Denmark,"Burgers, Fast Food",3.7,94,$,"Solid burger joint with OK fries and apparently very good Ben & Jerry's milkshakes. 

There was a line of people waiting for their food or to order, which...",0.0,0.764,0.236,0.7735,positive
Cv3eiXerzysKQ69IdBj5Tw,Grillen Nørrebro,Nørrebrogade 13 2200 Copenhagen Denmark,"Burgers, Fast Food",3.7,94,$,"Skuffet - Enttäuscht - Disappointed 

I had so much been looking forward to eat at Grillen. It had got great reviews, and it looks like a busy place. I...",0.087,0.728,0.185,0.5423,positive
Cv3eiXerzysKQ69IdBj5Tw,Grillen Nørrebro,Nørrebrogade 13 2200 Copenhagen Denmark,"Burgers, Fast Food",3.7,94,$,"It sometimes feels like all I'm eating is burgers, but who can blame me when there are so many great options in Copenhagen?! Grillen Nørrebro has long been...",0.086,0.69,0.224,0.7192,positive
Ek_i05hGiph7cvS0Al5NUQ,Cafe Phønix,Fredrikssundsvej 136 2700 Brønshøj Denmark,"Breakfast & Brunch, Burgers",3.1,14,$,"Visited this restaurant/ cafe on a Saturday evening for pizza. 
This Phonix is divided into two, one is the cafe with the ordinary cafe menu (burgers,...",0.0,1.0,0.0,0.0,neutral
Ek_i05hGiph7cvS0Al5NUQ,Cafe Phønix,Fredrikssundsvej 136 2700 Brønshøj Denmark,"Breakfast & Brunch, Burgers",3.1,14,$,You definitely come here for the brunch and their fries! I've been here multiple times with both family and friends and I always get great service and food.,0.0,0.71,0.29,0.8805,positive
Ek_i05hGiph7cvS0Al5NUQ,Cafe Phønix,Fredrikssundsvej 136 2700 Brønshøj Denmark,"Breakfast & Brunch, Burgers",3.1,14,$,"Pizza man is not very friendly. Otherwise its a good cafe ;)
Outside area in really nice and waitresses are very friendly and polite",0.086,0.572,0.343,0.8196,positive
0c_yHY2Kyp1PmnehzLjoHA,Royal Agra Palace,Frederikssundsvej 150 2700 Copenhagen Denmark,Indian,4.3,3,,I was so happily surprised when I found this place! My friend and I were in the mood for Indian and we gave it a try. It's a cozy little place with a great...,0.0,0.676,0.324,0.937,positive
exkSwt6KouVKzY1JIbId1Q,Ristorante La Rosa,Frederikssundsvej 164 2700 Brønshøj Denmark,Italian,4.7,3,,"Have been eating many times from this place (mainly takeaway). They have good pizzas, very good burger, but the best is the Indian style dishes such as...",0.0,0.709,0.291,0.8704,positive
43S_yfTXFOpzNAdnjvuwPw,Gastronomia Italiana,Frederikssundsvej 110 2400 Copenhagen Denmark,"Pizza, Italian",4.5,2,$,"This place is pretty good. I would say that the pizza here is one of the thicker varieties that I've had in Copenhagen. I was happy to see this, since many...",0.0,0.741,0.259,0.8689,positive
894bElthXCd_-FGOsmSVAA,Chicken and bagels,Frederikssundsvej 183 A 2700 Copenhagen Denmark,"Salad, Sandwiches, Bagels",4.5,2,,Have been to this place many times. They have very good bagels with chicken and all sorts of things to add to your bagel. Always fresh and tasty. Love their...,0.0,0.736,0.264,0.8655,positive
cPQvasGlgq2AJjloQ0aFNQ,Tribeca NV,Bygmestervej 2 2400 Copenhagen Denmark,"American, Italian",3.6,26,$$,"I made my first visit at Tribeca NV yesterday evening. Online we had seen, that there were lots of tables this night, so we didn't book anything. When we...",0.0,1.0,0.0,0.0,neutral
cPQvasGlgq2AJjloQ0aFNQ,Tribeca NV,Bygmestervej 2 2400 Copenhagen Denmark,"American, Italian",3.6,26,$$,"I give this place an extra star because of the shock value, and they carry one of my favorite wines from Sonoma Valley!

It's hidden away up in Nordvest,...",0.076,0.758,0.166,0.4753,positive
cPQvasGlgq2AJjloQ0aFNQ,Tribeca NV,Bygmestervej 2 2400 Copenhagen Denmark,"American, Italian",3.6,26,$$,"Har som næsten-nabo været på Tribeca NV en del gange nu, både for at spise, og bare for at hænge ud i den hyggelige går når vejret er til det. Desuden...",0.0,1.0,0.0,0.0,neutral
cPQvasGlgq2AJjloQ0aFNQ,Tribeca NV,Bygmestervej 2 2400 Copenhagen Denmark,"American, Italian",3.6,26,$$,"The place has a nice atmosphere, but the experience was somewhat like playing the lottery. Tried the 3 course menu (with 2 dishes per serving). Half of the...",0.0,0.794,0.206,0.6697,positive
