Yelp ID,Business name,Business address,Category,Average star rating,Review count,Price,review_text,vader_neg,vader_neu,vader_pos,vader_compound,vader_label
k6Tzvte26r_CTXovaYOoHg,Mielcke & Hurtigkarl,Frederiksberg Runddel 1 2000 Frederiksberg Denmark,Modern European,4.6,27,$$$$,"The service here was impeccable, the food was outstanding, but the wine pairings were really remarkable - the wine and food really enhanced each other in a...",0.0,0.761,0.239,0.8334,positive
k6Tzvte26r_CTXovaYOoHg,Mielcke & Hurtigkarl,Frederiksberg Runddel 1 2000 Frederiksberg Denmark,Modern European,4.6,27,$$$$,"5 stars are very little!
Beautiful scenery, amazing décor, super helpfully and friendly staff... and food that words are poor to describe! It's a truly...",0.073,0.424,0.502,0.9596,positive
k6Tzvte26r_CTXovaYOoHg,Mielcke & Hurtigkarl,Frederiksberg Runddel 1 2000 Frederiksberg Denmark,Modern European,4.6,27,$$$$,"My partner and I truly enjoyed our unique luncheon at Mielcke & Hurtigkarl. 

This is one of the most beautifully refined eccentric restaurants in the...",0.0,0.683,0.317,0.8805,positive
k6Tzvte26r_CTXovaYOoHg,Mielcke & Hurtigkarl,Frederiksberg Runddel 1 2000 Frederiksberg Denmark,Modern European,4.6,27,$$$$,"This review is long, but important for anyone looking to plan an event with Mielcke & Hurtigkarl. The short answer: don't.

----Short Version----

- We...",0.0,0.916,0.084,0.296,positive
D2bL3V9dUwJrysrEV4slkg,Bangkok,Nyelandsvej 39 2000 Frederiksberg Denmark,Thai,4.0,1,$,"This place serves good Thai food
- When we are up for take-out - we often order from this place.
- Never been disappointed ;-)

You can also dine as they...",0.049,0.796,0.155,0.5739,positive
qr2sZCgVv7aRbJaCxuJeCg,Falcon Kebab Shop,Falkoner Allé 12 B 2000 Frederiksberg Denmark,"Kebab, Falafel",5.0,3,$,"This place is a real find. Everything, or most things, seem to be handmade, the food tastes great, the owner is super kind and friendly and for the size and...",0.0,0.64,0.36,0.9393,positive
qr2sZCgVv7aRbJaCxuJeCg,Falcon Kebab Shop,Falkoner Allé 12 B 2000 Frederiksberg Denmark,"Kebab, Falafel",5.0,3,$,"This is right across Radisson Blu Falkoner.  

A true gem.  Owner has big heart and excellent hands to make home-made food. 

We ate two nights in a row....",0.0,0.7,0.3,0.8934,positive
mV_kF7m6GcIhU-SiyIUF6Q,formel B,Vesterbrogade 182 1800 Frederiksberg Denmark,"Modern European, Scandinavian",4.3,55,$$$$,"I visited Formel B while on a Scandinavian Vacation. Denmark is a top destination for fine dining, so I knew I wanted to try a Michelin Star restaurant...",0.0,0.878,0.122,0.3818,positive
mV_kF7m6GcIhU-SiyIUF6Q,formel B,Vesterbrogade 182 1800 Frederiksberg Denmark,"Modern European, Scandinavian",4.3,55,$$$$,"Many Michelin star restaurants offer a prix fixe menu where you may be less than thrilled on some of the dishes you will get, but Formel B offers you to...",0.0,0.941,0.059,0.2049,positive
mV_kF7m6GcIhU-SiyIUF6Q,formel B,Vesterbrogade 182 1800 Frederiksberg Denmark,"Modern European, Scandinavian",4.3,55,$$$$,"While it's one of the first restaurants in Denmark to earn a Michelin star, it has definitely been eclipsed by the superstar kitchens of NOMA, Geranium, and...",0.0,0.906,0.094,0.4019,positive
mV_kF7m6GcIhU-SiyIUF6Q,formel B,Vesterbrogade 182 1800 Frederiksberg Denmark,"Modern European, Scandinavian",4.3,55,$$$$,Hard to know where to start. We wanted to do a Michelin experience while in Copenhagen and chose formal B as our star experience. We had also chosen a...,0.048,0.952,0.0,-0.1027,negative
mV_kF7m6GcIhU-SiyIUF6Q,formel B,Vesterbrogade 182 1800 Frederiksberg Denmark,"Modern European, Scandinavian",4.3,55,$$$$,"I was again lucky to stop in for a ""no reservations,"" dinner.

The service here is a cross between à la carte and prixe-fixe. There are 12 plates available,...",0.069,0.844,0.087,0.1531,positive
mV_kF7m6GcIhU-SiyIUF6Q,formel B,Vesterbrogade 182 1800 Frederiksberg Denmark,"Modern European, Scandinavian",4.3,55,$$$$,This was incredible restaurant with a 5 course menu that should be considered one best restaurants in the world.  Considering it a Michelin star I can't be...,0.0,0.861,0.139,0.6369,positive
mV_kF7m6GcIhU-SiyIUF6Q,formel B,Vesterbrogade 182 1800 Frederiksberg Denmark,"Modern European, Scandinavian",4.3,55,$$$$,"Great food in a stylish setting. Some of the desserts were absolutely stunning and worth a repeat. The service though was occasionally clumsy, overly eager,...",0.0,0.648,0.352,0.8858,positive
ipg634saX2cEDxmMHFWEVg,Bjørnekælderen,Frederiksberg Alle 55 1820 Frederiksberg Denmark,"Scandinavian, Open Sandwiches",4.7,7,,"Always a unique, beautiful, and delicious experience. Fantastic friendly staff also. So much thought and talent goes into everything about Bjørnekælderen.",0.0,0.482,0.518,0.9531,positive
ipg634saX2cEDxmMHFWEVg,Bjørnekælderen,Frederiksberg Alle 55 1820 Frederiksberg Denmark,"Scandinavian, Open Sandwiches",4.7,7,,"Inventive, delicious food using local and seasonal ingredients. Friendly staff. Great wine pairings. Walk-in friendly.",0.0,0.437,0.563,0.9349,positive
ipg634saX2cEDxmMHFWEVg,Bjørnekælderen,Frederiksberg Alle 55 1820 Frederiksberg Denmark,"Scandinavian, Open Sandwiches",4.7,7,,Loved this meal! The tartar was so unique and unexpectedly amazing. The server was very nice and made me a martini off menu :) was recommended this place by...,0.0,0.602,0.398,0.9421,positive
ipg634saX2cEDxmMHFWEVg,Bjørnekælderen,Frederiksberg Alle 55 1820 Frederiksberg Denmark,"Scandinavian, Open Sandwiches",4.7,7,,"The waitress is so so nice and funny and took the time to explain to me what the dishes were. I even had snaps recommendations :)
The food is amazing! I had...",0.0,0.663,0.337,0.9351,positive
ipg634saX2cEDxmMHFWEVg,Bjørnekælderen,Frederiksberg Alle 55 1820 Frederiksberg Denmark,"Scandinavian, Open Sandwiches",4.7,7,,A hidden gem that I would never have found on my own if not for my local friends. We were brought here by our lovely Danish friends. The menu is in Danish...,0.0,0.744,0.256,0.875,positive
t3j1A8YPW9Xx3I5jah0rWQ,Restaurant India,Hostrupsvej 2 1950 Frederiksberg Denmark,Indian,4.4,8,$,"This is GREAT Indian food, I should know, I'm Indian. :)  Well, 'great' by Copenhagen standards.  I will always say the best Indian food outside of India is...",0.0,0.558,0.442,0.9597,positive
t3j1A8YPW9Xx3I5jah0rWQ,Restaurant India,Hostrupsvej 2 1950 Frederiksberg Denmark,Indian,4.4,8,$,"Delicious butter chicken served with yummy doughy naan, and gently seasoned basmati rice, all made fresh each day, resulting in an excellent and satisfying...",0.0,0.485,0.515,0.959,positive
t3j1A8YPW9Xx3I5jah0rWQ,Restaurant India,Hostrupsvej 2 1950 Frederiksberg Denmark,Indian,4.4,8,$,Really impressive food. The chicken was perfectly coocked and the Mango lassi was tasty. One of the best places we have eaten Indian food in Copenhagen. The...,0.0,0.667,0.333,0.9184,positive
CkMqUfNDQqcx_8QdOpYE-g,WEDOFOOD - Frederiksberg,Gammel Kongevej 176 1850 Frederiksberg Denmark,"Food, Salad",4.0,11,$,"Wow, who knew salads can taste so good!? Everything is super fresh and high quality. And their portions are huge! I couldn't even finish my entire salad....",0.0,0.57,0.43,0.9487,positive
CkMqUfNDQqcx_8QdOpYE-g,WEDOFOOD - Frederiksberg,Gammel Kongevej 176 1850 Frederiksberg Denmark,"Food, Salad",4.0,11,$,"Delicious fresh salads, very vegetarian friendly. I got the Superveg and it is really tasty. Staff were really cool and helpful. indoor and outdoor seating...",0.0,0.569,0.431,0.9341,positive
CkMqUfNDQqcx_8QdOpYE-g,WEDOFOOD - Frederiksberg,Gammel Kongevej 176 1850 Frederiksberg Denmark,"Food, Salad",4.0,11,$,"Great prices. Would recommend if you have to eat on a budget. The ingredients are fresh and you have a lot of choices. 
Tasty. The dressing are nice and the...",0.0,0.69,0.31,0.8934,positive
HSNS-TjYC0Q76YQ9VCD2Hg,MG Petersens familiehave,Pile Allé 16 2000 Frederiksberg Denmark,Danish,3.4,5,$$$,"This very quant, and probably culturally significant garden of eating paradise located in Fredericksberg, which is really next door to what is called...",0.0,0.778,0.222,0.7184,positive
PsJn1XSuyd4JjLGWdOMBuw,Acacia,Gammel Kongevej 171 1850 Frederiksberg Denmark,"Patisserie/Cake Shop, Vegan, Breakfast & Brunch",4.3,10,$$,"SO MUCH YES! Acacia is an all vegan place with a menu that changes constantly. I was SO excited to try this place when I heard it was opening. 

My...",0.0,0.762,0.238,0.8668,positive
PsJn1XSuyd4JjLGWdOMBuw,Acacia,Gammel Kongevej 171 1850 Frederiksberg Denmark,"Patisserie/Cake Shop, Vegan, Breakfast & Brunch",4.3,10,$$,I had been dying to come here for months now and today I finally made the journey to Acacia. It's a really cute place with everything made to order. I was...,0.0,0.901,0.099,0.5095,positive
PsJn1XSuyd4JjLGWdOMBuw,Acacia,Gammel Kongevej 171 1850 Frederiksberg Denmark,"Patisserie/Cake Shop, Vegan, Breakfast & Brunch",4.3,10,$$,"This place has the potential to be a nice ice cream spot, but it still has a lot of growing to do. I don't think it was quite ready for opening day.

The...",0.0,0.797,0.203,0.7677,positive
PsJn1XSuyd4JjLGWdOMBuw,Acacia,Gammel Kongevej 171 1850 Frederiksberg Denmark,"Patisserie/Cake Shop, Vegan, Breakfast & Brunch",4.3,10,$$,Came there about an hour before closing and some things on the menu was sold out. Of course it can be annoying but it also tells me that everything is...,0.06,0.94,0.0,-0.2144,negative
PsJn1XSuyd4JjLGWdOMBuw,Acacia,Gammel Kongevej 171 1850 Frederiksberg Denmark,"Patisserie/Cake Shop, Vegan, Breakfast & Brunch",4.3,10,$$,"Spent my afternoon here. Acacia is super cozy and all vegan!!! The baristas are very kind and accomodating. I had the spiced apple waffles, the Twix bar,...",0.0,0.747,0.253,0.858,positive
PsJn1XSuyd4JjLGWdOMBuw,Acacia,Gammel Kongevej 171 1850 Frederiksberg Denmark,"Patisserie/Cake Shop, Vegan, Breakfast & Brunch",4.3,10,$$,"Looking forward to seeing this place evolve. Nice concept and hope it improves over time. Love the fact that they have GF/DF options, so that is always a...",0.0,0.654,0.346,0.9136,positive
PsJn1XSuyd4JjLGWdOMBuw,Acacia,Gammel Kongevej 171 1850 Frederiksberg Denmark,"Patisserie/Cake Shop, Vegan, Breakfast & Brunch",4.3,10,$$,Amazing place. Classic clean Danish decoration and very friendly people. Alice makes all the ice cream and is so sweet. The ginger cookie peach cobbler ice...,0.0,0.614,0.386,0.9308,positive
kipfBB2A5tbMXAfIUhT2uQ,Sale e Pepe,Nordre Fasanvej 9 2000 Frederiksberg Denmark,Italian,4.3,4,$$$,"""Has the best pasta ever I love it"" says my 9 year old son. Sale e Pepe is our neighborhood Italian restaurant which is always very welcoming to our family....",0.0,0.7,0.3,0.9117,positive
h-5YvgKOLsfU-ig_Ri0LRQ,Wagamama,Solbergvej 3 2000 Frederiksberg Denmark,Japanese,3.0,22,$$,"Just visited this wagamama located in Frederiksberg and I had a very pleasant experience. 
It surprises me that it only has 2,5 stars on yelp. It's worth...",0.0,0.765,0.235,0.7501,positive
h-5YvgKOLsfU-ig_Ri0LRQ,Wagamama,Solbergvej 3 2000 Frederiksberg Denmark,Japanese,3.0,22,$$,delicious and not expensive. it's always my choice when don't know what to eat. my favorite dish is wagamama lamen. the pork is crispy. the cauliflower is...,0.0,0.789,0.211,0.7717,positive
h-5YvgKOLsfU-ig_Ri0LRQ,Wagamama,Solbergvej 3 2000 Frederiksberg Denmark,Japanese,3.0,22,$$,"Great flavours .. Nice deco and warm , friendly service and super fast kitchen team ! Well-done !",0.0,0.441,0.559,0.9476,positive
h-5YvgKOLsfU-ig_Ri0LRQ,Wagamama,Solbergvej 3 2000 Frederiksberg Denmark,Japanese,3.0,22,$$,"Stricly okay. The chain has come to Frederiksberg. The food is the standard Wagamama fare - some good some bad. The prices are okay, perhaps on the higher...",0.102,0.702,0.196,0.296,positive
h-5YvgKOLsfU-ig_Ri0LRQ,Wagamama,Solbergvej 3 2000 Frederiksberg Denmark,Japanese,3.0,22,$$,"Very disappointing! I have ordered the noodles with chicken and shrimps and I only found 2 shrimps in it, a few peaces of chicken and lot of onion. Too much...",0.108,0.803,0.089,-0.1742,negative
h-5YvgKOLsfU-ig_Ri0LRQ,Wagamama,Solbergvej 3 2000 Frederiksberg Denmark,Japanese,3.0,22,$$,Great Asian fusion food with tons of choices. Both times I've been here I've gotten the same thing and both times it has not disappointed. Firecracker beef...,0.0,0.79,0.21,0.7687,positive
q609IE6zRY1Ex3ojz-twOQ,Sticks 'n' Sushi,Gammel Kongevej 120 1850 Frederiksberg Denmark,Sushi Bars,4.1,26,$$$,"This is my second sticks and sushi that I have been to and I must say the one in Tivoli is a bit better. However, I loved the food and it definitely is my...",0.0,0.765,0.235,0.8591,positive
q609IE6zRY1Ex3ojz-twOQ,Sticks 'n' Sushi,Gammel Kongevej 120 1850 Frederiksberg Denmark,Sushi Bars,4.1,26,$$$,"Really a lovely place. I really enjoyed lunch here.

The sushi was really good, and the entire meal was nice and fancy.

...although expensive.

The people...",0.0,0.617,0.383,0.9282,positive
q609IE6zRY1Ex3ojz-twOQ,Sticks 'n' Sushi,Gammel Kongevej 120 1850 Frederiksberg Denmark,Sushi Bars,4.1,26,$$$,"I came here again last week after craving sushi and thought I would give it another shot. Honestly, I am still not convinced that this is the best...",0.066,0.726,0.209,0.7133,positive
q609IE6zRY1Ex3ojz-twOQ,Sticks 'n' Sushi,Gammel Kongevej 120 1850 Frederiksberg Denmark,Sushi Bars,4.1,26,$$$,"Honestly, the sushi was great! Maybe even the best I've had in Europe. But service was not so great. Our bill came to 3500kr. For sushi, 2000kr for wine &...",0.146,0.664,0.19,-0.2143,negative
q609IE6zRY1Ex3ojz-twOQ,Sticks 'n' Sushi,Gammel Kongevej 120 1850 Frederiksberg Denmark,Sushi Bars,4.1,26,$$$,"My last dinner in Copenhagen. i loved the service. Both waiters were very attentive and helped me understand my options. It's an upscale restaurant, very...",0.0,0.86,0.14,0.5994,positive
q609IE6zRY1Ex3ojz-twOQ,Sticks 'n' Sushi,Gammel Kongevej 120 1850 Frederiksberg Denmark,Sushi Bars,4.1,26,$$$,"Best sushi in the area I know of, but a bit pricey. Their sticks are also delicious. Basically the quality is pretty consistent in every sticks and sushi I...",0.0,0.685,0.315,0.9178,positive
q609IE6zRY1Ex3ojz-twOQ,Sticks 'n' Sushi,Gammel Kongevej 120 1850 Frederiksberg Denmark,Sushi Bars,4.1,26,$$$,"The sushi is all great, and my factoid sticks are the goat cheese wrapped in ham and the scallops. Start with the spicy edamame. It is almost always crowded...",0.0,0.872,0.128,0.6249,positive
wGmkCfUMgFTfXnJley0LHw,Satang Thai Bistro,Åboulevard 51 1960 Frederiksberg Denmark,Thai,4.8,4,,"This place is very very good. Incredibly authentic. How do you know? 
They have Thai Select certification. This means the Thai government approved the...",0.0,0.778,0.222,0.7408,positive
wGmkCfUMgFTfXnJley0LHw,Satang Thai Bistro,Åboulevard 51 1960 Frederiksberg Denmark,Thai,4.8,4,,"Great Thai food as they should be. Tom Yam, spareribs, pad Thai all great. Please stay the same, love the place just as it is.",0.0,0.588,0.412,0.9403,positive
wGmkCfUMgFTfXnJley0LHw,Satang Thai Bistro,Åboulevard 51 1960 Frederiksberg Denmark,Thai,4.8,4,,"New local restaurant with a very pleasing ambience and a Pad Thai you'll LOVE.  Prices are very reasonable, friendly service and conveniently located from...",0.0,0.634,0.366,0.9202,positive
LJ737M6RcHYtks4SBIWUxQ,Da Cavallino pizzeria,Nordre Fasanvej 137 2000 Frederiksberg Denmark,Pizza,5.0,4,,The best local pizza place in the area. Using a big wood fired oven makes their pizzas way better than the other local places.,0.114,0.662,0.224,0.5423,positive
gHjKigZKATuUXHLVJJ3rJg,Fitnesso,Godthåbsvej 26 2000 Copenhagen Denmark,"Restaurants, Juice Bars & Smoothies",4.0,12,$,Tonight I was hangry and on my way to a 3hr Danish class- a recipe for disaster- when I decided to stop in here. When I heard the delightful sounds of Tupac...,0.161,0.742,0.097,-0.3612,negative
gHjKigZKATuUXHLVJJ3rJg,Fitnesso,Godthåbsvej 26 2000 Copenhagen Denmark,"Restaurants, Juice Bars & Smoothies",4.0,12,$,"Tasty but more like a toast than a sandwich. Minimalistic seating. 
Good place for a snack but not ideal if your hungry unless you go for a meal, then...",0.098,0.699,0.203,0.5961,positive
RKraihLrhCjO8UbDIAtUwA,Restaurant Radio,Julius Thomsens Gade 12 1632 Copenhagen Denmark,Scandinavian,4.4,42,$$$,I came here with a local and learned that Restaurant Radio is named so because it is located directly opposite the former headquarters of the Danish...,0.0,1.0,0.0,0.0,neutral
RKraihLrhCjO8UbDIAtUwA,Restaurant Radio,Julius Thomsens Gade 12 1632 Copenhagen Denmark,Scandinavian,4.4,42,$$$,Dining at Radio was an amazing surprise for me and I did not expect to like it as much as I did.  Located in a Copenhagen neighborhood close to a subway...,0.059,0.778,0.164,0.5845,positive
RKraihLrhCjO8UbDIAtUwA,Restaurant Radio,Julius Thomsens Gade 12 1632 Copenhagen Denmark,Scandinavian,4.4,42,$$$,Had a 5 course meal tasting pared with wine tasting with colleagues. The restaurant is small and cozy. Tables are quite close together. So close in fact...,0.0,1.0,0.0,0.0,neutral
RKraihLrhCjO8UbDIAtUwA,Restaurant Radio,Julius Thomsens Gade 12 1632 Copenhagen Denmark,Scandinavian,4.4,42,$$$,"So very good. I still think about this place, their bread, their butter and the incredibly wonderful local food. 

Copenhagen has some of the best food in...",0.0,0.673,0.327,0.9129,positive
RKraihLrhCjO8UbDIAtUwA,Restaurant Radio,Julius Thomsens Gade 12 1632 Copenhagen Denmark,Scandinavian,4.4,42,$$$,"Claus Meyer has an amazing legacy in Denmark. Not many folks outside of Scandanavia know that he owns delis, bakeries, flour/vinegar produciton and is also...",0.0,0.863,0.137,0.5859,positive
RKraihLrhCjO8UbDIAtUwA,Restaurant Radio,Julius Thomsens Gade 12 1632 Copenhagen Denmark,Scandinavian,4.4,42,$$$,"We went there for dinner on 5/26/15, I am very happy that I booked this restaurant in advance when I only stayed in Copenhagen for just less than 24 hours....",0.0,0.879,0.121,0.6115,positive
RKraihLrhCjO8UbDIAtUwA,Restaurant Radio,Julius Thomsens Gade 12 1632 Copenhagen Denmark,Scandinavian,4.4,42,$$$,We opted for the three course option with wine pairing.  The wines were absolutely fantastic and went perfectly with the meal. They also had several...,0.0,0.74,0.26,0.8439,positive
2c-k2ezELjj2DtuIPGfS9A,Børma Bar,Nyelandsvej 21 C 2000 Frederiksberg Denmark,"Dive Bars, Restaurants",4.2,5,$,I came to Denmark to visit my friend's family and his new sister-in-law works at this location so I had a BLAST here on two separate nights drinking and...,0.0,1.0,0.0,0.0,neutral
nRkVwUnSlK0aAF7yGCRpww,Omakase,Vesterbrogade 171 1800 Frederiksberg Denmark,"Sushi Bars, Japanese",4.0,11,$$,Welcome to my life- my new favourite sushi place in Copenhagen. Me and my boyfriend have decided us to go through most of Copenhagen's sushi place in order...,0.0,0.9,0.1,0.4588,positive
nRkVwUnSlK0aAF7yGCRpww,Omakase,Vesterbrogade 171 1800 Frederiksberg Denmark,"Sushi Bars, Japanese",4.0,11,$$,Nice and friendly staff who quickly made our order. The sushi both looked and tasted good!,0.0,0.586,0.414,0.8478,positive
nRkVwUnSlK0aAF7yGCRpww,Omakase,Vesterbrogade 171 1800 Frederiksberg Denmark,"Sushi Bars, Japanese",4.0,11,$$,"I ordered take out from here and I must say, it's quite fresh compared to other places I've tried. Price wise is a little more but the quality is worth it....",0.0,0.819,0.181,0.6365,positive
4wPlKZzaZCh_H6O4Xr_98w,Wokshop,Gammel Kongevej 122 1850 Frederiksberg C Denmark,"Thai, Wok",3.3,27,$$,Beautiful ambiance with poor service and quality food with bland basic flavor.  If you're not familiar with the rich flavors of Thailand and want food...,0.094,0.638,0.267,0.6908,positive
4wPlKZzaZCh_H6O4Xr_98w,Wokshop,Gammel Kongevej 122 1850 Frederiksberg C Denmark,"Thai, Wok",3.3,27,$$,Much more calm than the city Wokshop. Good food and chill place. Lunch offer. Friendly staff.,0.0,0.599,0.401,0.8268,positive
4wPlKZzaZCh_H6O4Xr_98w,Wokshop,Gammel Kongevej 122 1850 Frederiksberg C Denmark,"Thai, Wok",3.3,27,$$,Tasty food and lunch special prices. Passionate host and good service. I will be back,0.0,0.571,0.429,0.8402,positive
4wPlKZzaZCh_H6O4Xr_98w,Wokshop,Gammel Kongevej 122 1850 Frederiksberg C Denmark,"Thai, Wok",3.3,27,$$,"Nicely prepared, standard Thai fare. An appetizer, two entrees, and two drinks ran about 325 DKK. The entrees were very large. I recommend splitting one and...",0.0,0.753,0.247,0.7624,positive
4wPlKZzaZCh_H6O4Xr_98w,Wokshop,Gammel Kongevej 122 1850 Frederiksberg C Denmark,"Thai, Wok",3.3,27,$$,Nice eastern food a mix between Thai and Chinese. Nice hip place for large group or friends or two people,0.0,0.661,0.339,0.8271,positive
4wPlKZzaZCh_H6O4Xr_98w,Wokshop,Gammel Kongevej 122 1850 Frederiksberg C Denmark,"Thai, Wok",3.3,27,$$,"Nice place, pad thai was quite bland, chicken basil was ok though disappointingly non spicy, but the tom yum goong was amazing!!!! I would go back just to...",0.054,0.67,0.276,0.8367,positive
4wPlKZzaZCh_H6O4Xr_98w,Wokshop,Gammel Kongevej 122 1850 Frederiksberg C Denmark,"Thai, Wok",3.3,27,$$,this was a good quick asian meal.  it is asian fusion but mostly thai and very fresh veggies/meats.  nice ambiance also.  i take away one star because they...,0.0,0.726,0.274,0.8568,positive
C2_OEW8YKQpdF556Wcvwxg,Sushi Factory,Godthåbsvej 96 2000 Frederiksberg Denmark,Sushi Bars,4.1,12,$,Decent sushi for affordable price. I ordered for pick up and it was ready even earlier than they said it would be,0.0,0.894,0.106,0.3612,positive
yJM7lY89ynHrq64VB2ZkYA,Cafe on the Six,Valby Tingsted 6 2500 Valby Denmark,"Breakfast & Brunch, Sandwiches",4.8,9,$,"Exceptional service here!

The owner is from Spain and do not miss a conversation with him! Friendly guy indeed.

The place is chill so it was a respite on...",0.0,0.838,0.162,0.6402,positive
yJM7lY89ynHrq64VB2ZkYA,Cafe on the Six,Valby Tingsted 6 2500 Valby Denmark,"Breakfast & Brunch, Sandwiches",4.8,9,$,"While exploring Valby, I stumbled on this small cafe, and I am so glad I did. It was difficult to choose what to order because the menu is a mouth-watering...",0.073,0.815,0.113,0.3327,positive
yJM7lY89ynHrq64VB2ZkYA,Cafe on the Six,Valby Tingsted 6 2500 Valby Denmark,"Breakfast & Brunch, Sandwiches",4.8,9,$,What a wonderful little gem in the heart of Valby! A perfectly cozy Cafe for a lunch or coffee break - with mostly vegan and gluten free options! All...,0.0,0.61,0.39,0.9515,positive
yJM7lY89ynHrq64VB2ZkYA,Cafe on the Six,Valby Tingsted 6 2500 Valby Denmark,"Breakfast & Brunch, Sandwiches",4.8,9,$,"Fresh, healthy, simple and delicious menu of coffee, teas, juices, smoothies, bowls, sandwiches and desserts. Very reasonable prices, especially considering...",0.0,0.615,0.385,0.8402,positive
yJM7lY89ynHrq64VB2ZkYA,Cafe on the Six,Valby Tingsted 6 2500 Valby Denmark,"Breakfast & Brunch, Sandwiches",4.8,9,$,"I had the best acai bowl here!!! Cute cafe, indoor and outdoor seating. Friendly staff, laid back environment, healthy and delicious food options. The...",0.0,0.518,0.482,0.9564,positive
nusfgwfAmV1g8JamlkKOqA,La Vecchia,Falkoner Allé 17 2000 Frederiksberg Denmark,Italian,3.2,11,$$,An average restaurant in the centre of Frederiksberg. It's a little cosy place that's good for family and friends. It's good but not extraordinary. I had...,0.0,0.794,0.206,0.6059,positive
nusfgwfAmV1g8JamlkKOqA,La Vecchia,Falkoner Allé 17 2000 Frederiksberg Denmark,Italian,3.2,11,$$,"The Place was crowded around 8 P.M. so I had to sit in the corner. It didn't matter since the personnel was very friendly. And the food was good too, had...",0.03,0.789,0.18,0.7445,positive
j7Ba6XFJn3TtaUjIwCBQpQ,D'Taste,Godthåbsvej 48 2000 Frederiksberg Denmark,"Vietnamese, Chinese",5.0,1,,"Absolutely awesome food. Strongly recommend it if you have a craving for Vietnamese and are in Copenhagen. 
The waitress are very nice and are eager to help...",0.0,0.545,0.455,0.9481,positive
X-R60RhXSX6BDVKIeGlaww,Bodrum Pizzeria,Smallegade 56 2000 Frederiksberg Denmark,"Burgers, Fast Food, Pizza",2.7,3,$,"This place is best described as a generic turkish-run Pizza-Place. 
The Galatasaray scarf hung above the counter gave them away. Nothing special about this...",0.079,0.773,0.148,0.4482,positive
1gyawNJOcGNvJQrmmYMnWA,Mors Køkken,Godthåbsvej 16 2000 Frederiksberg Denmark,"Barbeque, Scandinavian, Steakhouses",3.7,6,$,"Mors Køkken has officially been added to me short list of Single People Solutions in Copenhagen, and once again, it's right around the corner from my house!...",0.0,0.929,0.071,0.2481,positive
aAdoFSaZlK8tbOSPx7Ozyw,Café Moccador,Falkoner Allé 23 2000 Frederiksberg Denmark,Restaurants,2.9,21,$,"Located just outside Frederiksberg Metro station, Cafe Moccador is everyone's favorite hangout space. The place is split into 2 levels and turns into a bar...",0.0,0.889,0.111,0.4588,positive
GHbXLKwL92PvRao7L0gMJQ,The Bronx Burger Bar,Godthåbsvej 30 2000 Frederiksberg Denmark,Burgers,2.9,9,$$,"For the price this bar has good burgers. I got the jack daniels one and it was super tasty But a bit messy. 
I went on a Monday night so it was pretty...",0.079,0.701,0.22,0.7046,positive
GHbXLKwL92PvRao7L0gMJQ,The Bronx Burger Bar,Godthåbsvej 30 2000 Frederiksberg Denmark,Burgers,2.9,9,$$,"Not the best burger you'd have but definitely not bad.

They offer student discounts with valid ID! There are plenty of outdoor and indoor seatings. I think...",0.065,0.71,0.225,0.7531,positive
GHbXLKwL92PvRao7L0gMJQ,The Bronx Burger Bar,Godthåbsvej 30 2000 Frederiksberg Denmark,Burgers,2.9,9,$$,"Took my wife there for our 22nd anniversary and it was pretty good. The burgers were a bit too dry and could have used more sauce in between the fillings,...",0.0,0.821,0.179,0.7269,positive
SgsFk1qAC_LnvorSDOqV-w,Pizzicato,Gammelkongevej 101 1850 Frederiksberg Denmark,Italian,4.6,7,$,"Pizza base is good, but the toppings of the vegetarian pizza, very cold and oily grilled vegetables, ruined it completely. 
Plus, please check the spelling...",0.132,0.699,0.169,0.0432,neutral
